artist_name,track_name,release_date,genre,lyrics
Arctic Monkeys,Old Yellow Bricks,2007,indie-rock,"Old yellow bricks, love's a risk Quite the little escapologist Looked so miffed when you wished For a thousand places better than this You are the fugitive but you don't know what you're running from You can't kid us and you couldn't trick anyone Houdini, love, you don't know what you're running away from  Who wants to sleep in a city that never wakes up? Blinded by nostalgia Who wants to sleep in a city that never wakes up?  She was enraged by the way That the emperors were trapped in the cage And the days she deemed dull Leading to nights reading beer bottles You're such a fugitive but you don't know what you're running from You can't kid us and you couldn't trick anyone Houdini, love, you don't know what you're running away from  Who wants to sleep in a city that never wakes up? Blinded by nostalgia Who wants to sleep in a city that never wakes up? You might also like You're at a loss just because It wasn't all that you thought it was You are the fugitive but you don't know what you're running away from She said, I want to sleep in the city that never wakes up And revel in nostalgia I know I said, Who wants to sleep in a city that never wakes up? But Dorothy was right though59Embed"
TV Girl,Cigarettes out the Window,2016,indie-rock,"Boy now who smokes cigarettes out that window Boy now who smokes cigarettes out that window  My girl Liddy used to always smoke Cigarettes when she couldn't sleep She'd disappear for an hour and a half And when she'd come back, she'd brush her teeth But I could still smell it on her raggedy tee And I could taste it on her lips when we kissed Poor little Liddy used to always quit But she never really quit She'd just say she did  Boy now who smokes cigarettes out that window (Ooh-ooh) Boy now who smokes cigarettes out that window (Ooh-ooh) Boy now who smokes cigarettes out that window (Ooh-ooh) Boy now who smokes cigarettes out that window (Ooh-ooh)  My girl Liddy used to always smoke Cigarettes when she couldn't sleep I wonder what she did when she got done I guess she'd just flick them out in the street Poor little Liddy, she wishes it was dark But it's never really dark in LA The light from the billboard always shines But it changed twelve times since you went away You might also like Boy now who smokes cigarettes out that window (Ooh-ooh) Boy now who smokes cigarettes out that window (Ooh-ooh) Boy now who smokes cigarettes out that window (Ooh-ooh) Boy now who smokes cigarettes out that window (Ooh-ooh)  You'll find moonlit nights strangely empty because when you call my name through them there'll be no answer Rather melodramatic, aren't you? You'll find moonlit nights strangely empty because when you call my name through them there'll be no answer You mind if I smoke? You'll find moonlit nights strangely empty because when you call my name through them there'll be no answer (Ooh-ooh) I always smoke with the theatre You'll find moonlit nights strangely empty because when you call my name through them there'll be no answer (Ooh-ooh) Somehow it enhances the performance12Embed"
Pinegrove,Old Friends,2016,indie-rock,"Walking outside labyrinthian Over cracks along under the trees I know this town grounded in a compass Cardinal landing in the dogwood I keep going over it over and over My steps iterate my shame How come every outcome's such a comedown? Lately afternoon with the shades drawn down  Kept saying I just wanted to see you Saying, What's wrong with that? Needles shaking outlines in a compass Every outcome's such a comedown  I knew it when I saw it So, I did just what I wanted So, I go through with this I knew happiness when I saw it  I saw your boyfriend at the Port Authority Sort of fucked up place Well so I averted my stride on a quick one He's coming back from going over to your place, huh? You might also likeI feel like I could forget about it I feel like I could mellow out I don't feel undone in a big way There's nothing really bad to be upset about  But when I thought I was getting better I woke up on the ground An appointment or a disappointment A setback, oh, another comedown  As if I needed a reminder Oh, I do only what I wanna So, I go through with this  Walking out in the nighttime springtime Needling my way home I saw Leah on the bus a few months ago I saw some old friends at her funeral My steps keep splitting my grief Through these solipsistic moods I should call my parents when I think of them Should tell my friends when I love them Maybe I should have gone out a bit more When you guys were still in town I got too caught up in my own shit That's how every outcome's such a comedown  And I knew it when I saw it Oh, I did just what I wanted So, I go through with this I knew happiness when I saw it (And I saw it)10Embed"
​girl in red,Serotonin,2021,indie-rock,"I'm running low on serotonin Chemical imbalance got me twisting things Stabilize with medicine There's no depth to these feelings Dig deep, can't hide From the corners of my mind I'm terrified of what's inside  I get intrusive thoughts Like cutting my hands off Like jumping in front of a bus Like how do I make this stop When it feels like my therapist hates me? Please don't let me go crazy Put me in a field with daisies Might not work, but I'll take a maybe Oh, been breaking daily But only me can save me So I'm capitulating, crying likе a fucking baby I don't wanna miss it, ba-da I don't wanna be sick, ah-da I don't, la-ba-deh-deh-ba-dеh Da-da-da-brah-la-da-da You might also like I'm running low on serotonin Chemical imbalance got me twisting things Stabilize with medicine There's no depth to these feelings Dig deep, can't hide From the corners of my mind I'm terrified of what's inside  I get intrusive thoughts Like burning my hair off Like hurting somebody I love Like, does it ever really stop? When there's control, I lose it Incredibly impulsive So scared I'm gonna end up doing something stupid But I try to contain it Oh, it gets so draining It's like my heart is failing Every night, I'm contemplating My inner voice is saying tough So I try to brush it off Yeah, I try to brush it off  I'm running low on serotonin Chemical imbalance got me twisting things Stabilize with medicine But there's no depth to these feelings Dig deep, can't hide From the corners of my mind I'm terrified of what's inside Kan man ikke, kan man kjenne i hjertet at, hvis man får blodpropp? Jeg følte liksom flere ganger at hjertet mitt slutta å slå at, og sånn at Eller, som jeg fortalte, at jeg ble helt sånn tung og rar i kroppen47Embed"
Big Thief,Paul,2016,indie-rock,"Oh, the last time I saw Paul I was horrible and almost let him in But I stopped and caught the wall And my mouth got dry so all I did was take him for a spin Yeah, we hopped inside my car And I drove in circles 'round the freight train yard And he turned the headlights off Then he pulled the bottle out And then he showed me what was love  I'll be your morning bright goodnight shadow machine I'll be your record player, baby, if you know what I mean I'll be your real tough cookie with the whiskey breath I'll be a killer and a thriller and the cause of our death  In the blossom of the months I was sure that I'd get driven off with thought So I swallowed all of it As I realized there was no one who could kiss away my shit  I'll be your morning bright goodnight shadow machine I'll be your record player baby if you know what I mean I'll be your real tough cookie with the whiskey breath I'll be a killer and a thriller and the cause of our death You might also like Paul, I know you said that you'd take me any way I came or went But I'll push you from my brain See, you're gentle, baby I couldn't stay, I'd only bring you pain  I was your starry-eyed lover and the one that you saw I was your hurricane rider and the woman you'd call We were just two moonshiners on the cusp of a breath And I've been burning for you baby since the minute I left20Embed"
Radiohead,House of Cards,2007,indie-rock,"I don't want to be your friend I just want to be your lover No matter how it ends No matter how it starts  Forget about your house of cards And I'll do mine Forget about your house of cards And I'll do mine And fall off the table, get swept under Denial, denial  The infrastructure will collapse From voltage spikes Throw your keys in the bowl Kiss your husband 'goodnight'  And forget about your house of cards And I'll do mine Forget about your house of cards And I'll do mine Fall off the table, get swept under Denial, denial Denial, denial (Your ears should be burning) Denial, denial (Your ears should be burning)You might also like23Embed"
Rainbow Kitten Surprise,Cocaine Jesus,2013,indie-rock,"Listen in, it isn't when you're talking for your name's sake Jesus, Mary Magdalene you are, are you okay? Sitting by the well, Jill you’re falling down the hill Jack and everybody laughed Don't you pray, don't you pray?  To a Cocaine Jesus in a black four-seater Got a man, don't need him, but you wait Call me when you want, or just call me when you need it If you only ever need it for the day  High won't hold, won't hold And I have no more than all you left of me I have, I have, I have no more than all you leave  High as hell, feeling fine, nothing bad but nothing kind Not, not a word from me, at least nothing you would mind In my head, in my head I get lonely sometimes Feeling fly, coming down, never bad cause we're never out You'll never call the cops again, I'll never call her mine In my head, in my head I get lonely sometimes You might also like When you find an old picture of us And you clear away the dust I hope you miss me sometimes When you see a frame that reminds you of me Do you remember the times Oh the times that we believed?  In a Cocaine Jesus in a black four-seater Got a man, don't need him, but you wai-ai-ai-ait Call me when you want, or just call me when you need it If you only ever need it for the day  High won't hold, won't hold And I have no more than all you left of me I have, I have, I have no more than all you leave  And I'm nothing more than a page unwritten on the pavement Blowing in the wind You win a lot and lose just a little bit more Than you gained in the end But God I wish that I was better than I am But no luck, no love, no Gospel I could understand I'm nothing that you ever wanted to lean on, yeah But even then When you find an old picture of us And you clear away the dust I hope you miss me sometimes When you see a frame that reminds you of me Do you remember the times Oh the times that we believed?  In a Cocaine Jesus in a black four-seater Got a man, don't need him, but you wait Call me when you want, or just call me when you need it If you only ever need it for the day  Today I'm just a page unwritten on the pavement You needed 'til you left But I'm more than a need or a thing you believe Or a word that you leave unsaid11Embed"
Radiohead,Subterranean Homesick Alien,1997,indie-rock,"The breath of the morning I keep forgetting The smell of the warm summer air I live in a town where you can't smell a thing You watch your feet for cracks in the pavement Up above aliens hover Making home movies for the folks back home Of all these weird creatures who lock up their spirits Drill holes in themselves and live for their secrets  They're all uptight, uptight Uptight, uptight Uptight, uptight  I wish that they'd swoop down in a country lane Late at night when I'm driving Take me on board their beautiful ship Show me the world as I'd love to see it I'd tell all my friends but they'd never believe me They'd think that I'd finally lost it completely I'd show them the stars and the meaning of life They'd shut me away  But I'd be alright, alright Mom, I'm alright, alright You might also like I'm just uptight, uptight Uptight, uptight Uptight, uptight Uptight, uptight Uptight32Embed"
The Strokes,Last Nite,2001,indie-rock,"Last night, she said Oh, baby, I feel so down Oh, it turn me off When I feel left out So I, I turned 'round Oh, baby, don't care no more I know this for sure I'm walkin' out that door Well, I've been in town for just 'bout fifteen, oh, minutes now And, baby, I feel so down And I don't know why I keep walkin' for miles  And see people, they don't understand No, girlfriends, they can't understand Your grandsons, they won't understand On top of this, I ain't ever gonna understand  Last night, she said Oh, baby, don't feel so down Oh, it turn me off When I feel left out So I, I turned 'round Oh, baby, gonna be alright It was a great big lie 'Cause I left that night, yeah You might also like  Oh, people, they don't understand No, girlfriends, they don't understand In spaceships, they won't understand And me, I ain't ever gonna understand  Last night, she said Oh, baby, I feel so down See, it turn me off When I feel left out So I, I turned 'round Oh, little girl, I don't care no more I know this for sure I'm walkin' out that door, yeah39Embed"
Arctic Monkeys,Stop the World I Wanna Get Off With You,2013,indie-rock,"Open Sesame (We've places to go) We've people to see (Let's put 'em on hold) There's all sorts of shapes that I bet you can make When you want to escape, say the word  Well, I know that getting you alone isn't easy to do With the exception of you, I dislike everyone in the room And I don't wanna lie, but I don't wanna tell you the truth Get the sense that you're on the move And you'll probably be leaving soon, so I'm telling you  Stop the world 'cause I wanna Get off with you Stop the world 'cause I wanna Get off with you  Eyes the colour of (Water left in mud) Icing sugar dust (Crazy green flashes) It's a funny thing that I cannot explain Don't you know the train keeps a-rolling?  Stop the world 'cause I wanna Get off with you Stop the world 'cause I wanna Get off with you You might also like  Well, I know that getting you alone isn't easy to do And I don't wanna lie, and I don't wanna tell you the truth And I know we got places to go, we got people to see Think we both oughta put 'em on hold and I know you agree  Stop the world 'cause I wanna Get off with you Stop the world 'cause I wanna Get off with you49Embed"
Lovejoy,Concrete,2021,indie-rock,"One, two, one, two, three, four  Any more words? I think you've spoke enough 'Cause the pubs are empty and they're closing up When you're spitting spite as fast as saliva But with the prose of a standard English drunk, she says I hope the saltwater ruins your clothes And I hope you spend the rest of your life sleeping alone I hope the problems that make your life harder Sit stubborn in your stomach like your kidney stones, and yet  All this, over a kiss! You weren't therе, why you pressed by this? Now it's turning three in the morning Thе bouncer's put you on his third warning But I'm still here, I'm not leaving  You won't get what you need (All this over a kiss!) You know it's always the same, it's all just a game If I had it my way, you'd sleep on the concrete floor What'd you say to me? (All this over a kiss!) 'Cause I'm not sure I'm not sure they'd let you off easily You might also like It's a pissed-off march up to the bus stop station With pissed-up eyes glossed with earlier conversations And the consequence of your desperation Is the people on the nightbus have to listen to you! And all I'm saying is (Woo!) How can you look at yourself in the windowpane Without wanting to hit yourself? But your fist descends through the condensation  All this, over a kiss! You weren't there, so why you pressed by this? Now it's turning three in the morning The bouncer's put you on his third warning But I'm still here, I'm not leaving  You won't get what you need (All this over a kiss!) You know it's always the same, it's all just a game If I had it my way, you'd sleep on the concrete floor What'd you say to me? (All this over a kiss!) 'Cause I'm not sure I'm not sure they'd let you off easily57Embed"
The Strokes,"Call It Fate, Call It Karma",2013,indie-rock,"Close the door Not all the way He don't understand We don't understand So don't you wanna remind me I don't know a thing And some of us remember And some run out of place  Can I waste all your time here on the sidewalk? Can I stand in your light just for a while? I've waited around to wait in a room Having a hard time watching you  You got it down now, don't you? I wanted to understand your face So don't you wanna remind me I don't know a thing And some of us remember And some run out of place  Can I waste all your time here on the sidewalk? Can I stand in your light just for a while? I've waited around to wait in a room Having a hard time watchin' you (Watchin' you) You might also like I needed someone I needed someone45Embed"
The Strokes,The Modern Age,2001,indie-rock,"Up on a hill, here's where we begin This little story, a long time ago Start to pretend, stop pretendin' It seems this game is simply never-endin'  Oh, in the sun, sun, havin' fun, it's in my blood I just can't help it Don't want you here right now, let me go Oh, let me g-g-g-g-g-g-g-go  Leaving just in time, stay there for a while Rollin' in the ocean, tryin' to catch her eye Work hard and say it's easy, do it just to please me Tomorrow will be different, so I'll pretend I'm leaving   I feel so different now, we trained at A-V-A I wish you hadn't stayed, my vision's clearer now but I'm unafraid Flyin' overseas, no time to feel the breeze I took too many varieties You might also like Oh, in the sun, sun, havin' fun, it's in my blood I just can't help it Don't want you here right now, let me go, woo! Darling, let me g-g-g-g-g-g-g-go  Leaving just in time, stay there for a while Rollin' in the ocean, tryin' to catch her eye Work hard and say it's easy, do it just to please me Tomorrow will be different, so this is why I'm leavin'28Embed"
Mitski,A Burning Hill,2016,indie-rock,"Today, I will wear my white button-down I'm tired of wanting more, I think I'm finally worn For you have a way of promising things And I've been a forest fire, I am a forest fire  And I am the fire, and I am the forest And I am a witness watching it I stand in a valley watching it And you are not there at all  So today, I will wear my white button-down I can at least be neat, walk out and be seen as clean And I'll go to work, and I'll go to sleep And I'll love the littler things  I'll love some littler thingsSee Mitski LiveGet tickets as low as $9You might also like27Embed"
The Neighbourhood,Baby Came Home 2 / Valentines,2015,indie-rock,"She was five-foot four with some money on the floor And a box that's hidden under her bed I was only twenty-two with a pocket full of truth But I gave her everything that I had We were born and raised in the Golden State Mommy's gone and daddy's doing his best I was brought up great, living Section 8 Social security's paying the rent, oh-oh-oh (Ooh) The landlord called, she said, You gotta go (Ooh) Little one, you just lost your (Ooh-ooh) (Yeah)  She was five-foot four, getting money on tour But her socks were at the end of my bed Got our names tattooed on each other Just to prove to each other that we'd do what we said Only took a few days 'til our minds were made up And we thought we should try it again I was only seventeen when we first tried things When she first made me feel like a man, oh-oh (Ooh-ooh)  Who am I gonna call? (Ooh) Who's gonna catch me when I— (Ooh) Who's the one you're sleeping with? (Ooh) You might also like Well, don't just sit in front of me and wait for me to talk You can call me up, phone works two ways, you know This time, baby, yeah, I think that I'll be just fine And I wish I could say the same for you I, yeah, I do, I, hey  (Yeah, yeah, yeah) (Hey, hey, hey) (Yeah, yeah, yeah) (Ah-ah) (Ah-ah) (Ah-ah)   To those of you in which I choose to always be the closest to There's something that you need to know Loving me is not a joke And you can put it all on me, you can laugh and you can bleed And I'll adopt it all because that's just what a buddy does I loved you from minute one, the iced tea to my lemonade Never one to hit and run, soaking every minute made You can give me all your juice, I can squeeze it out for you And all I ask you in exchange, love me back through every phase If it ever comes off wrong or leaves you with a bitter taste Just remember you're the tea And I'm your sour lemonade, I'm your sour lemonade Tropical iced tea and hot pink lemonade21Embed"
The Killers,Read My Mind,2007,indie-rock,"On the corner of Main Street Just tryna keep it in line You say you wanna move on and You say I'm falling behind Can you read my mind? Can you read my mind?  I never really gave up on Breaking out of this two-star town I got the green light, I got a little fight I'm gonna turn this thing around Can you read my mind? (Oooh) Can you read my mind? (Oooh)  The good old days, the honest man The restless heart, the Promised Land A subtle kiss that no one sees A broken wrist and a big trapeze Oh, well, I don't mind if you don't mind 'Cause I don't shine if you don't shine Before you go, can you read my mind?  It’s funny how you just break down Waiting on some sign I pull up to the front of your driveway With magic soaking my spine Can you read my mind? (Oooh) Can you read my mind? (Oooh) See The Killers LiveGet tickets as low as $70You might also like The teenage queen, the loaded gun The drop dead dream, the Chosen One A southern drawl, a world unseen A city wall and a trampoline Oh, well, I don't mind, if you don't mind 'Cause I don't shine if you don't shine Before you jump, tell me what you find When you read my mind  Slipping in my faith until I fall He never returned that call Woman, open the door, don't let it sting I wanna breathe that fire again She said, I don't mind, if you don't mind (I don't mind, if you don't mind) 'Cause I don't shine if you don't shine (I don't shine if you don't shine) Put your back on me, put your back on me (I don't mind, if you don't mind) Oh, put your back on me Oooh  The stars are blazing like rebel diamonds cut out of the sun Can you read my mind? (Oooh oooh)30Embed"
Arctic Monkeys,A Certain Romance,2006,indie-rock,"(Shall I keep rolling?)  Well, oh, they might wear classic Reeboks Or knackered Converse, or tracky bottoms tucked in socks But all of that's what the point is not The point's that there in't no romance around there And there's the truth that they can't see They'd probably like to throw a punch at me And if you could only see 'em then you would agree Agree that there in't no romance around there  You know? Oh, it's a funny thing, you know We'll tell 'em if you like, we'll tell 'em all tonight They'll never listen, because their minds are made up And course it's all okay to carry on that way  'Cause over there there's broken bones There's only music so that there's new ringtones And it don't take no Sherlock Holmes To see it's a little different around here Don't get me wrong though, there's boys in bands And kids who like to scrap with pool cues in their hands And just 'cause he's had a couple of cans He thinks it's all right to act like a dickhead You might also like Don't you know? Oh, it's a funny thing, you know We'll tell 'em if you like, we'll tell 'em all tonight They'll never listen, because their minds are made up And course it's all okay to carry on that way  But I said no, oh no Well, you won't get me to go Not anywhere, not anywhere No, I won't go, oh, no, no   But over there, there's friends of mine What can I say? I've known 'em for a long long time And they might overstep the line But you just cannot get angry in the same way No, not in the same way Said, not in the same way Oh no, oh no, no 73Embed"
