artist_name,track_name,release_date,genre,lyrics
Tally Hall,&,2011,indie-rock,"Love of the S*n  Came back again to make it clear that He never said it would meet demand Shame on a martyr claiming friends from Either perspective of &  Weak & Strong & Wet & Dry & Right & Wrong & Live & Die & Sane & Gone & Love & Not & All the &s that we forgot So sing while you hear it, don't deny it Leave if you can't stand the thought of it Come back again to make things stand With no disrespect to the &  High & Low & New & Old & Stop & Go & Hot & Cold & John & Yoko Dark & Light It's almost time to say goodnight to it You might also like They took a lesson from their fathers Told them that they were the same command Wait for their minds to make complete Their lies stuck beside every &  Words & Numbers Sound & Silence Stop the peace & Keep the violence No & Yes & We digress It lives with sad & happiness, Oh God  Big bad Betty of the 'pocalypse She opens her lips & it goes like this When the golden rule & the jungle meet There'll be nothing to love & there'll be no one to beat Oh, the things we know, the things we don't Oh, the things we think we can will & won't We're loath to gather & nothing's left We're all together & we're all bereft Capitalists, communists You did the hokey-pokey & it went like this You hate each other & you love yourselves It might be heaven & it might be hell Oh, the things we do The things we say Oh, the things we wish we could wash away63Embed"
Glass Animals,Life Itself,2016,indie-rock,"Daddy was dumb, said that I'd be something special Brought me up tough but I was a gentle human Said that he loved each of my two million freckles When I grew up, was gonna be a superstar  I can't get a job, so I live with my mum I take her money but not quite enough I sit in the car and I listen to static She said I look fat, but I look fantastic  Cut back down to my knees Gotta get back, gotta get free Cut back down to my knees Lean back now, lean back and breathe Cut back down to my knees Gotta get back, gotta get free Cut back down to my knees Lean back now, lean back and breathe  I'm wakin' up lost in boxes outside Tesco Look like a bum sippin' codeine Coca-Cola Thought that I was northern Camden's own Flash Gordon Sonic ray gun, gonna be a superstar You might also like I can't get a job, so I live with my mum I take her money but not quite enough I make my own fun in Grandmama's basement Said I look mad, she said I look wasted  Cut back down to my knees Gotta get back, gotta get free Cut back down to my knees Lean back now, lean back and breathe Cut back down to my knees Gotta get back, gotta get free Cut back down to my knees Lean back now, lean back and breathe  Cut back down to my knees Gotta get back, gotta get free Cut back down to my knees Lean back now, lean back and breathe Cut back down to my knees Gotta get back, gotta get free Cut back down to my knees Lean back now, lean back and breathe Cut back down to my knees Gotta get back, gotta get free Cut back down to my knees Lean back now, lean back and breathe30Embed"
Phoebe Bridgers,Chinese Satellite,2020,indie-rock,"I've been runnin' around in circles Pretending to be myself Why would somebody do this on purpose When they could do something else? Drowning out the morning birds With the same three songs over and over I wish I wrote it, but I didn't, so I learn the words Hum along 'til the feeling's gone forever  Took a tour to see the stars But they weren't out tonight So I wished hard on a Chinese satellite I want to believe Instead, I look at the sky and I feel nothing You know I hate to be alone I want to be wrong  You were screamin' at the Evangelicals They were screamin' right back from what I remember When you said, I will never be your vegetable Because I think when you're gone, it's forever But you know I'd stand on the corner Embarrassed with a picket sign If it meant I would see you when I die You might also like Sometimes, when I can't sleep It's just a matter of time before I'm hearing things Swore I could feel you through the walls But that's impossible I want to believe (I want to believe) That if I go outside, I'll see a tractor beam Coming to take me to where I'm from I want to go home25Embed"
The Mountain Goats,No Children,2002,indie-rock,I hope that our few remaining friends Give up on trying to save us I hope we come up with a failsafe plot To piss off the dumb few that forgave us I hope the fences we mended Fall down beneath their own weight And I hope we hang on past the last exit I hope it's already too late  And I hope the junkyard a few blocks from here Someday burns down And I hope the rising black smoke carries me far away And I never come back to this town again  In my life I hope I lie And tell everyone you were a good wife And I hope you die I hope we both die  I hope I cut myself shaving tomorrow I hope it bleeds all day long Our friends say it's darkest before the sun rises We're pretty sure they're all wrong I hope it stays dark forever I hope the worst isn't over And I hope you blink before I do And I hope I never get sober See The Mountain Goats LiveGet tickets as low as $44You might also like And I hope when you think of me years down the line You can't find one good thing to say And I'd hope that if I found the strength to walk out You'd stay the hell out of my way  I am drowning There is no sign of land You are coming down with me Hand in unlovable hand And I hope you die I hope we both die22Embed
Vampire Weekend,Unbelievers,2013,indie-rock,"Got a little soul The world is a cold, cold place to be Want a little warmth But who's going to save a little warmth for me? We know the fire awaits unbelievers All of the sinners the same Girl, you and I will die unbelievers Bound to the tracks of the train  If I'm born again I know that the world will disagree Want a little grace But who's gonna say a little grace for me?  We know the fire awaits unbelievers All of the sinners the same Girl, you and I will die unbelievers Bound to the tracks of the train  I'm not excited, but should I be? Is this the fate that half of the world has planned for me? I know I love you, and you love the sea But what holy water contains a little drop, little drop for me? See Vampire Weekend LiveGet tickets as low as $27You might also like See the sun go down It's going on down and the night is deep Want a little light But who's gonna save a little light for me?  We know the fire awaits unbelievers All of the sinners the same Girl, you and I will die unbelievers Bound to the tracks of the train  I'm not excited, but should I be? Is this the fate that half of the world has planned for me? I know I love you, and you love the sea But what holy water contains a little drop, little drop for me?   I'm not excited, but should I be? Is this the fate that half of the world has planned for me? I know I love you, and you love the sea But what holy water contains a little drop, little drop for me?45Embed"
Big Red Machine,Renegade,2021,indie-rock,"I tapped on your window on your darkest night The shape of you was jagged and weak There was nowhere for me to stay, but I stayed anyway And if I would've known How many pieces you had crumbled into I might have let them lay  Are you really gonna talk about timing in times like these? And let all your damage damage me And carry your baggage up my street And make me your future history, it’s time You've come a long way, open the blinds, let me see your face You wouldn't be the first renegade to need somebody  Is it insensitive for me to say Get your shit together so I can love you? Is it really your anxiety that stops you From giving me everything Or do you just not want to?  I tapped on your window on your darkest night The shape of you was jagged and weak There was nowhere for me to stay, but I stayed anyway You fire off missiles ’cause you hate yourself But do you know you're demolishing me? And then you squeeze my hand as I'm about to leave You might also like Are you really gonna talk about timing in times like these? And let all your damage damage me And carry your baggage up my street And make me your future history, it's time You've come a long way, open the blinds, let me see your face You wouldn't be the first renegade to need somebody  Is it insensitive for me to say Get your shit together so I can love you? Is it really your anxiety that stops you From giving me everything Or do you just not want to?  And if I would've known How sharp the pieces were you'd crumbled into I might’ve let them lay  Are you really gonna talk about timing in times like these? And let all your damage damage me And carry your baggage up my street And make me your future history, it’s time You've come a long way, open the blinds, let me see your face You wouldn’t be the first renegade to need somebody To need somebody, to need somebody To need somebody, to need Are you really gonna talk about timing in times like these? And let all your damage damage me And carry your baggage up my street And make me your future history, it's time Is it insensitive for me to say Get your shit together so I can love you? You've come a long way, open the blinds, let me see your face You wouldn't be the first renegade to need somebody Is it really your anxiety that stops you From giving me everything Or do you just not want to?27Embed"
Rainbow Kitten Surprise,Devil Like Me,2013,indie-rock,"My heart and soul were never mine to own What you care to die for, what you care to die for? We die alone, we'll all die young What you care to die for, what you care to die from? Snow, snow glistens on the ledge, whiskey on the bed Shake it out and light a cigarette Miss me when you, you wish you weren't right  Shake me all out if I'm wrong For you, for you Shake it all out when I'm gone I, for you  Is the devil so bad if he cries in his sleep while the earth turns? And his kids learn to say, Fuck you, they don't love you Does the devil get scared if she dies in her dreams while the earth burns? She cries 'cause she's nothin' like you, is she like you?  What you want from a devil like me, devil like me? You see, the devil don't mean to be evil He just regrettably forgets to exceed expectation Holes riddled in your head, little bit of lead Shake it out and line a silhouette Miss me when you, you wish weren't kind of glad You might also like Shake me all out when you're done For you, for you Shake it all out when I'm gone I, you  Is the devil so bad if he cries in his sleep while the earth turns? And his kids learn to say, Fuck you, they don't love you Does the devil get scared if she dies in her dreams while the earth burns? She cries 'cause she's nothin' like you, is she like you?  What do you want from a devil like me? Am I like you?12Embed"
Bon Iver,For Emma,2007,indie-rock,"So apropos Saw death on a sunny snow  For every life Forgo the parable Seek the light My knees are cold  Running home, running home Running home, running home  Go find another lover To bring a To string along  With all your lies You're still very lovable I toured the light So many foreign roads  For Emma, forever agoYou might also like38Embed"
Arctic Monkeys,I Bet You Look Good on the Dancefloor,2005,indie-rock,"Stop makin' the eyes at me I'll stop makin' the eyes at you What it is that surprises me Is that I don't really want you to  And your shoulders are frozen (Cold as the night) Oh, but you're an explosion (You're dynamite) Your name isn't Rio, but I don't care for sand And lighting the fuse might result in a bang, b-b-bang-oh  I bet that you look good on the dancefloor I don't know if you're lookin' for romance or I don't know what you're lookin' for I said, I bet that you look good on the dancefloor Dancin' to electro-pop like a robot from 1984 Well, from 1984  I wish you'd stop ignorin' me Because it's sending me to despair Without a sound, yeah, you're calling me And I don't think it's very fair You might also like That your shoulders are frozen (Cold as the night) Oh, but you're an explosion (You're dynamite) Your name isn't Rio, but I don't care for sand And lighting the fuse might result in a bang, b-b-bang-oh  I bet that you look good on the dancefloor I don't know if you're lookin' for romance or I don't know what you're lookin' for I said, I bet that you look good on the dancefloor Dancin' to electro-pop like a robot from 1984 Well, from 1984  And no, there in't no love, no Montagues or Capulets Just banging tunes and DJ sets and Dirty dancefloors and dreams of naughtiness  Well, I bet that you look good on the dancefloor I don't know if you're lookin' for romance or I don't know what you're lookin' for I said, I bet that you look good on the dancefloor Dancin' to electro-pop like a robot from 1984 Said, from 198483Embed"
Cigarettes After Sex,Sunsetz,2017,indie-rock,"Sunsets We wander through a foreign town Strangely, there's nobody else around So you open your dress and show me your tits On the swing set at the old playground  And when you go away, I still see you With sunlight on your face in my rear-view  Sunsets I wanna hear your voice A love that nobody could destroy Took photographs like Brautigan's book covers That we both adored  And when you go away, I still see you With sunlight on your face in my rear view This always happens to me this way Recurring visions of such sweet days And when you go away, I still see you With sunlight on your face in my rear view When you go away, I still see you With sunlight on your face in my rear viewSee Cigarettes After Sex LiveGet tickets as low as $42You might also like18Embed"
AWOLNATION,Sail,2010,indie-rock,"Sail  This is how I show my love I made it in my mind because I blame it on my ADD, baby This is how an angel dies I blame it on my own sick pride Blame it on my ADD, baby  Sail Sail Sail Sail Sail  Maybe I should cry for help Maybe I should kill myself Blame it on my ADD, baby Maybe I'm a different breed Maybe I'm not listening So blame it on my ADD, baby You might also like Sail Sail Sail Sail Sail  La-la-la-la-la, la-la-la-la-la, oh La-la-la-la-la, la-la-la-la-la, oh  Sail Sail Sail Sail Sail  (Sail with me into the dark) Sail (Sail with me into the dark) Sail (Sail with me into the dark) Sail (Sail with me, sail with me) Sail174Embed"
Arctic Monkeys,Do Me a Favour,2007,indie-rock,"Well, the mourning was complete When there was tears on the steering wheel dripping on the seat Several hours or several weeks I'd have the cheek to say they're equally as bleak  It's the beginning of the end The car went up the hill and disappeared around the bend Ask anyone, they'll tell you that it's these times that it tends To start to break in half, to start to fall apart, hold on to your heart  And do me a favour and break my nose Or do me a favour and tell me to go away Or do me a favour and stop asking questions  As she walked away, well, her shoes were untied And the eyes were all red, you could see that we'd cried And I watched and I waited till she was inside Forcing a smile and waving goodbye Curiosity becomes a heavy load Too heavy to hold, too heavy to hold Curiosity becomes a heavy load Too heavy to hold, will force you to be cold You might also like Do me a favour and ask if you need some help She said, Do me a favour and stop flattering yourself And to tear apart the ties that bind Perhaps fuck off might be too kind Perhaps fuck off might be too kind62Embed"
Beach Bunny,Prom Queen,2018,indie-rock,"Shut up, count your calories I never look good in mom jeans Wish I was like you Blue-eyed blondie, perfect body  Maybe I should try harder You should lower your expectations I'm no Quick-Curl Barbie I was never cut out for Prom Queen  If I get more pretty, do you think he will like me?  Dissect my insecurities I'm a defect surgical project It's getting hard to breathe There's plastic wrap in my cheeks  Maybe I should try harder You should lower your beauty standards I'm no Quick-Curl Barbie I was never cut out for Prom Queen You might also like If I'm pretty, will you like me? They say beauty makes boys happy I've been starving myself, carving Skin until my bones are showing  Teach me how to be okay I don't want to downplay my emotions They say beauty is pain You'll only be happy If you look a certain way I wanna be okay I wanna be okay32Embed"
Neutral Milk Hotel,"Holland, 1945",1998,indie-rock,"Two, one, two, three, four  The only girl I've ever loved Was born with roses in her eyes But then they buried her alive One evening, 1945 With just her sister at her side And only weeks before the guns All came and rained on everyone Now she's a little boy in Spain Playing pianos filled with flames On empty rings around the sun All sing to say my dream has come  But now we must pack up every piece Of the life we used to love Just to keep ourselves At least enough to carry on  And now we ride the circus wheel With your dark brother wrapped in white Says it was good to be alive But now he rides a comet's flame And won't be coming back again The Earth looks better from a star That's right above from where you are He didn't mean to make you cry With sparks that ring and bullets fly On empty rings around your heart The world just screams and falls apart You might also like But now we must pack up every piece Of the life we used to love Just to keep ourselves At least enough to carry on  And here's where your mother sleeps And here is the room where your brothers were born Indentions in the sheets Where their bodies once moved but don't move anymore And it's so sad to see the world agree That they'd rather see their faces filled with flies All when I'd want to keep white roses in their eyes47Embed"
Radiohead,Reckoner,2007,indie-rock,Reckoner You can't take it with you Dancing for your pleasure  You are not to blame for Bittersweet distractor Dare not speak its name Dedicated to all hu– All human beings  Because we separate like ripples on a blank shore (In rainbows) Because we separate like ripples on a blank shore (In rainbows)  Reckoner Take me with you Dedicated to all hu– All human beingsYou might also like40Embed
Cage The Elephant,Trouble,2015,indie-rock,"Ooh, ooh-ooh Ooh-ooh Ooh, ooh-ooh Ooh-ooh Ooh, ooh-ooh Ooh-ooh Ooh, ooh-ooh Ooh-ooh  We were at the table by the window with the view Casting shadows, the sun was pushing through Spoke a lot of words, I don't know if I spoke the truth  Got so much to lose Got so much to prove God, don't let me lose my mind  Trouble on my left, trouble on my right I've been facing trouble almost all my life My sweet love, won't you pull me through? Everywhere I look, I catch a glimpse of you I said it was love and I did it for life, didn't do it for you See Cage The Elephant LiveGet tickets as low as $31You might also like Ooh, ooh-ooh Ooh-ooh Ooh, ooh-ooh Ooh-ooh  We will come to pass, will I pass the test? You know what they say, yeah The wicked get no rest You can have my heart, any place, any time  Got so much to lose Got so much to prove God, don't let me lose my mind  Trouble on my left, trouble on my right I've been facing trouble almost all my life My sweet love, won't you pull me through? Everywhere I look, I catch a glimpse of you I said it was love and I did it for life, didn't do it for you  Trouble on my left, trouble on my right I've been facing trouble almost all my life My sweet love, won't you pull me through? Everywhere I look, I catch a glimpse of you I said it was love and I did it for life, didn't do it for you  Ooh, ooh-ooh Ooh-ooh Ooh, ooh-ooh Ooh-ooh Ooh, ooh-ooh Ooh-ooh Ooh, ooh-ooh Ooh-ooh  Got so much to lose Got so much to prove God, don't let me lose my mind22Embed"
Lord Huron,The Night We Met,2015,indie-rock,"(Ooh, ooh, ooh) (Ooh, ooh, ooh) (Ooh, ooh, ooh) (Ooh, ooh, ooh)  I am not the only traveler Who has not repaid his debt I've been searching for a trail to follow again Take me back to the night we met And then I can tell myself What the hell I'm supposed to do And then I can tell myself Not to ride along with you  I had all and then most of you Some and now none of you Take me back to the night we met I don't know what I'm supposed to do Haunted by the ghost of you Oh, take me back to the night we met  When the night was full of terrors And your eyes were filled with tears When you had not touched me yet Oh, take me back to the night we met See Lord Huron LiveGet tickets as low as $52You might also like I had all and then most of you Some and now none of you Take me back to the night we met I don't know what I'm supposed to do Haunted by the ghost of you Take me back to the night we met120Embed"
Arctic Monkeys,One Point Perspective,2018,indie-rock,"Dancing in my underpants I'm gonna run for government I'm gonna form a covers band anorl (Stop) Back there by the baby grand Did Mr. Winter Wonderland Say, Come 'ere, kid, we really need to talk? Bear with me, man, I lost my train of thought  I fantasise, I call it quits I swim with the economists And I get to the bottom of it for good By the time reality hits The chimes of freedom fell to bits The shining city on the fritz They come out of the cracks, thirsty for blood (Stop)  Oh, just as the apocalypse finally gets prioritised And you cry some of the hottest tears you ever cried Multiplied by five I suppose a singer must die  Singsong 'Round the Money Tree This stunning documentary That no one else unfortunately saw Such beautiful photography It's worth it for the opening scene I've been driving 'round listening to the score Or maybe I just imagined it all I've played to quiet rooms like this before Bear with me, man, I lost my train of thoughtYou might also like29Embed"
Glass Animals,Youth,2016,indie-rock,"Boy, when I left you you were young I was gone, but not my love You were clearly meant for more Than a life lost in the war  I want you to be happy Free to run, get dizzy on caffeine Funny friends that make you laugh And maybe you're just a little bit dappy  Fly Feel your mother right at your side, don't you know you got my eyes I'll make you fly You'll be happy all the time, I know you can make it right  Boy, now your life is back-to-front But you'll see that's not for long 'Cause I know you'll feel the ghost Of some memories so warm  Boy, I want you to be happy Free to run, get dizzy on caffeine Funny friends that make you laugh And maybe you're just a little bit dappy You might also like Fly Feel your mother right at your side, don't you know you got my eyes I'll make you fly You'll be happy all the time, I know you can make it right  Boy, I want you to be happy Free to run, get dizzy on caffeine Funny friends that make you laugh And maybe you're just a little bit dappy  Fly Feel your mother right at your side, don't you know you got my eyes I'll make you fly You'll be happy all the time, I know you can make it right I'll make you...  Boy, I want you to be happy Free to run, get dizzy on caffeine Funny friends that make you laugh And maybe you're just a little bit...  Woo, woo, woo40Embed"
Arctic Monkeys,Fireside,2013,indie-rock,"I can't explain but I wanna try There's this image of you and I And it goes dancing by In the morning and in the night time There's all these secrets that I can't keep Like in my heart there's that hotel suite And you lived there so long It's kind of strange now you're gone  I'm not sure if I should show you what I've found Has it gone for good, or is it coming back around? Isn't it hard to make up your mind When you're losing and your fuse is fireside?  There's all those places we used to go And I suspect you already know But that place on memory lane you like still looks the same But something about it's changed  I'm not sure if I should show you what I've found Has it gone for good, or is it coming back around? Isn't it hard to make up your mind When you're losing and your fuse is fireside? You might also like And I thought I was yours forever Or maybe I was mistaken But I just cannot manage to make it through the day Without thinking of you lately   I'm not sure if I should show you what I've found Has it gone for good, or is it coming back around? Isn't it hard to make up your mind When you're losing and your fuse is fireside?53Embed"
Capital Cities,Safe and Sound,2011,indie-rock,I could lift you up I could show you what you wanna see And take you where you wanna be You could be my luck Even if the sky is falling down I know that we'll be safe and sound  We're safe and sound  I could fill your cup You know my river won't evaporate This world we still appreciate You could be my luck Even in a hurricane of frowns I know that we'll be safe and sound  (Safe and sound) We're safe and sound (Safe and sound) We're safe and sound (Hold your ground) We're safe and sound (Safe and sound) You might also like I could show you love In a tidal wave of mystery You'll still be standing next to me You could be my luck Even if we're six feet underground I know that we'll be safe and sound  We're safe and sound (Safe and sound) (Safe and sound) (Hold your ground) (Safe and sound)  I could lift you up I could show you what you wanna see And take you where you wanna be You could be my luck Even if the sky is falling down I know that we'll be safe and sound  I could lift you up I could show you what you wanna see And take you where you wanna be You could be my luck Even if the sky is falling down I know that we'll be safe and sound We're safe and sound We're safe and sound We're safe and sound We're safe and sound (Safe and sound) We're safe and sound (Safe and sound) We're safe and sound (Hold your ground) We're safe and sound (Safe and sound) We're safe and sound89Embed
